text,filename
"Kumar Abhinav
Experienced Data Analyst with Expertise in Supply Chain Optimization and AI/ML Solutions 
(650) 695-4346 | rushtoabhinavin@gmail.com| in/kumarabhinav05/ | Github | Tableau | Pleasanton, CA | 



Work Experience
RFXCEL (Part of Antares Vision). | Tech Lead – Business Analytics & Data, San Ramon, CA, 		           May 2023 – Present
After completing my tenure at VVF, I pursued an MS in Business Analytics. During my studies, I joined RFXCEL as a summer intern, and due to my impactful contributions, I was offered a full-time position. At RFXCEL, I led the development of analytics products by creating transactional dashboards using Elasticsearch and Kibana, significantly improving data retrieval latency. Additionally, I am working as a business analyst and I spearheaded a new product initiative to provide real-time data visualization by integrating AI/ML technologies. 
	Specific projects:
Led the development of operational data analytics products, creating transactional dashboards using Elasticsearch and SQL. Spearheaded real-time data visualization solutions for cloud operations, enhancing operational efficiency by 25%. Coordinated transformation initiatives across teams and ensured alignment with business goals by delivering data-driven insights to executives and measuring the success of initiatives against OKRs. 
Led advanced business operations analytics using a variety of tools, including Excel, SQL, PowerBI, and Python to generate insights and stakeholder-facing reports. Generating Revenue of $ X million from this product. 
Driving the development of state-of-the-art AI/ML technologies. Developed data analytics mechanisms leveraging Gen AI and LLM models within the company firewall. Successfully evangelized the data program monthly with VPs and the CTO at RFXCEL
Working as a liaison between multiple stakeholders including business teams, development teams, and external clients to ensure effective communication and project alignment.
Planned and executed upgrades for customers transitioning from end-of-life traceability software to new releases, collaborating with customers and Customer Success managers.
Conducted ad-hoc analyses and produced actionable reports to support daily operations and strategic decision-making.
Created a multidimensional system architecture, managing the alignment of tools, data sources, and processes to ensure business goals were met

Vvf India Limited | Supply Chain Analyst, Mumbai, India.                                                                                             Dec 2017 to Aug 2022
As a Supply Chain Analyst, led several key projects that optimized the supply chain process, improved manufacturing efficiency, and successfully passed internal audits by McKinsey. Achieved global inventory reduction and led the SAP GST Implementation roll-out team.
Specific projects:
Optimized supply chain processes and drove data analysis and reporting for better decision-making. Led cross-functional projects, including SAP GST implementation and global inventory reduction, resulting in significant savings. Developed custom data analytics tools to identify improvement opportunities, aligned with business objectives, and evaluated potential solutions for high-growth environments.
Led the global inventory reduction project. Categorized inventory into four buckets, analyzed each category, and implemented new purchasing models (JIT), materials exchange models, and scrapped dead inventory, resulting in $X million in savings and a 25% overall inventory reduction. Tools used: SAP, Python, SQL, and Tableau.
Engineered and implemented custom Python scripts using predictive analytics and regression models to decrease manufacturing losses by 18%. This effort exceeded expectations, with data visualization insights via Tableau ultimately leading to a 22% reduction in manufacturing costs, resulting in annual savings of $X million.

India Power Limited | Supply Chain Analyst, Kolkata, India 			        Mar 2016 to Nov 2017
For a short stint, I joined India Power to work on streamlining the supply chain, aiming to enhance organizational efficiency. 
Specific projects:
Implemented SAP PM (Plant Maintenance) and MM (Materials Management) modules to replace manual purchasing, order generation, and billing processes across all platforms, enhancing organizational efficiency by 25% by streamlining the Order to Billing management process

Bajaj Energy Limited | Supply Chain Project Manager, Noida, India			      Feb 2013 to Mar 2016
After Abhijeet Projects, I joined Bajaj Energy as the Supply Chain Project Manager to lead a data-driven project focused on securing an excise tax waiver from the federal government. The waiver amount achieved was almost double that of my previous project
Specific projects:
Collaborated with the Central Electricity Authority (CEA) of the Government of India to successfully secure Mega Power Project Status, resulting in a cost-saving achievement of $XX million. This data-driven project involved detailed data analysis, regulatory negotiation, and strategic planning.

Abhijeet Projects Limited | Supply Chain Project Manager, Ranchi, India			     Sept 2010 to Jan 2013
After Airox Nigen, I joined Abhijeet Projects to lead the design and implementation of SAP functions (PM/MM) and manage data-driven projects with the federal government, securing significant financial benefits.
Specific projects:
Navigated regulatory processes, securing an excise duty waiver for Mega Power Project Status with the Government of India's CEA, leading to savings of $XX million and exemplifying adept negotiation skills and regulatory expertise. 

Airox Nigen | Business Development Manager, Gurgaon, India	                             April 2009 to Sept 2010
Directly hired from school to manage business development initiatives, focusing on enhancing the company’s online presence and user experience
Specific projects:
       -   Spearheaded the design and launch of a website for the organization, enhancing its online presence and user experience. 

Skills 
Functional: Agile, SDLC, Jira, Git, Data Analysis, Dash Boarding, Data Optimization, Process Mapping, Delivery Presentation 
Technical: SAP, Python, MySQL, Kibana, Tableau, AWS, Elastic Search, MS Excel, SPSS, FASTAPI

Education and Academic Background
California State University East Bay, Hayward, CA
M.S. in Business Analytics, Aug 2022 to Dec 2023

Sathyabama Deemed University Chennai, India
B.Tech. in Chemical Engineering (Major), Aug 2005 - April 2009
B.E in Computer Science & Engineering (Minor), Aug 2006 – April 2009
",Kumar.Abhinav 5.docx
"Kumar Abhinav
Experienced Data Engineer & Analyst with Expertise in Supply Chain Optimization and AI/ML Solutions 
(650) 695-4346 | rushtoabhinavin@gmail.com| in/kumarabhinav05/ | Github | Tableau | Pleasanton, CA | 



Work Experience
LinkedIn | Sr. Software Engineer (Contractor), Mountain View, CA.                                                                        October 2024 to Present
In my role as a Sr. Software Engineer contractor at LinkedIn, I lead the development of AI agents using FastAPI to optimize internal workflows, reducing manual tasks by 40% and improving system performance. I collaborate with cross-functional teams to implement scalable, real-time solutions that enhance API response times and system throughput.
Specific projects:
Leading the development of advanced AI agents using FastAPI for efficient, scalable systems integration within LinkedIn’s platform. These AI agents automate internal processes, resulting in a 40% reduction in manual tasks and improving system efficiency by 30%.
Collaborated with product, data science, and engineering teams to ensure seamless integration of AI-driven solutions. This collaboration improved project delivery time by 20% and ensured the alignment of technology with business objectives.

RFXCEL (Part of Antares Vision). | Software Engineer, San Ramon, CA, 		        	          May 2023 – Present
After completing my tenure at VVF, I pursued an MS in Business Analytics. During my studies, I joined RFXCEL as a summer intern, Due to the significant impact of my contributions, I was offered a full-time role. In my current position as Tech Lead, in this role, I lead the development of data-driven systems and analytics products, focusing on real-time data visualization and data integration using Elasticsearch and SQL. These initiatives improved data retrieval latency by X% and enhanced decision-making. Additionally, I spearheaded the integration of AI/ML technologies to automate and optimize business processes, improving operational efficiency.
	Specific projects:
Led the development of operational data analytics products, creating transactional dashboards using Elasticsearch and SQL. Spearheaded real-time data visualization solutions for cloud operations, enhancing operational efficiency by 25%. Coordinated transformation initiatives across teams and ensured alignment with business goals by delivering data-driven insights to executives and measuring the success of initiatives against OKRs. 
Led advanced business systems analytics initiatives, utilizing tools such as Excel, SQL, Tableau, and Python to generate actionable insights and stakeholder-facing reports for customers like AbbVie, Walgreens etc. Delivered data-driven recommendations that contributed to generating $X million in revenue. 
Designed and developed a public API using Java for Luprolink (Client: AbbVie) to enable seamless data connectivity between their SAP systems and our databases. This API streamlined data integration processes, improving data sync times by 30% and ensuring real-time data availability.
Developed AI/ML-driven applications that enhanced supply chain forecast accuracy by X% and reduced operational delays through real-time data visualization and predictive analytics. Enhanced business performance through data-driven automation. 
Served as a liaison between business stakeholders, development teams, and external clients, ensuring seamless communication and project alignment. Converted business requirements into actionable JIRA tickets and led sprint planning to improve release timelines by 15% 
Planned and executed data system upgrades for customers transitioning from legacy traceability software to new platforms, working closely with Customer Success managers to ensure smooth data migration and system integration. Successfully migrated 38% of customers within 4 months, ensuring minimal disruption and seamless operations. 

Vvf India Limited | Supply Chain Analyst, Mumbai, India.                                                                                             Dec 2017 to Aug 2022
As a Supply Chain Analyst, led several key projects that optimized the supply chain process, improved manufacturing efficiency, and successfully passed internal audits by McKinsey. Achieved global inventory reduction and led the SAP GST Implementation roll-out team.
Specific projects:
Optimized supply chain processes and drove data analysis and reporting for better decision-making. Led cross-functional projects, including SAP GST implementation and global inventory reduction, resulting in significant savings. Developed custom data analytics tools to identify improvement opportunities, aligned with business objectives. 
Led the global inventory reduction project. Categorized inventory into four buckets, analyzed each category, and implemented new purchasing models (JIT), materials exchange models, and scrapped dead inventory, resulting in $X million in savings and a 25% overall inventory reduction. Tools used: SAP, Python, SQL, and Tableau.
Engineered and implemented custom Python scripts using predictive analytics and regression models to decrease manufacturing losses by 18%. This effort exceeded expectations, with data visualization insights via Tableau ultimately leading to a 22% reduction in manufacturing costs, resulting in annual savings of $X million.

India Power Limited | Supply Chain Analyst, Kolkata, India 			        Mar 2016 to Nov 2017
For a short stint, I joined India Power to work to led the implementation of SAP modules to streamline purchasing, order generation, and billing processes, improving efficiency by 25% across platforms.

Bajaj Energy Limited | Supply Chain Project Manager, Noida, India			        Feb 2013 to Mar 2016
After Abhijeet Projects, I joined Bajaj Energy to led a data-driven project to secure an excise tax waiver, achieving $XX million in savings. Collaborated with the Central Electricity Authority to obtain Mega Power Project Status, leveraging data analysis and strategic planning.

Abhijeet Projects Limited | Supply Chain Project Manager, Ranchi, India			        Sept 2010 to Jan 2013
After Airox Nigen, I joined Abhijeet Projects to oversaw SAP implementations and regulatory projects, securing a significant excise duty waiver, resulting in $XX million in savings through expert negotiation and strategic planning.

Airox Nigen | Business Development Manager, Gurgaon, India	                             April 2009 to Sept 2010
I was hired directly from school to manage business development initiatives, leading the design and launch of the company’s website, improving online presence and enhancing user engagement

Skills 
Functional: Agile, SDLC, Jira, Git, Data Analysis, Dash Boarding, Data Optimization, Process Mapping, Delivery Presentation 
Technical: SAP, Python, MySQL, Kibana, Tableau, AWS, Elastic Search, MS Excel, SPSS, FASTAPI, Java

Education and Academic Background
California State University East Bay, Hayward, CA
M.S. in Business Analytics, Aug 2022 to Dec 2023

Sathyabama Deemed University Chennai, India
B.Tech. in Chemical Engineering (Major), Aug 2005 - April 2009
B.E in Computer Science & Engineering (Minor), Aug 2006 – April 2009",Kumar.Abhinav.docx
"Kumar Abhinav
Experienced Program Manager specializing in Global Supply Chain Optimization and Strategic Planning. 
(650) 695-4346 | rushtoabhinavin@gmail.com| in/kumarabhinav05/ | Github | Tableau | Pleasanton, CA | 



Work Experience
RFXCEL (Part of Antares Vision). | Tech Lead, San Ramon, CA, 		                          May 2023 – Present
After completing my tenure at VVF, I pursued an MS in Business Analytics. During my studies, I joined RFXCEL as a summer intern, Due to the significant impact of my contributions, I was offered a full-time role. In my role as a Tech Lead, I drive supply chain product innovation and lead transformational efforts to integrate data-driven solutions into real-time visualization and analytics tools. These initiatives improved data retrieval latency and enhanced decision-making. Additionally, I spearheaded the integration of AI/ML technologies to automate and optimize business processes, improving operational efficiency	
Specific projects:
Rolled out an Operational data analytics product at the L5 level for the Kingdom of Bahrain. upscaling and upselling the Pharma Supply Chain Track and Traceability software, generating an additional $X million from a single customer, and improving operational efficiency by 25% through data-driven insights and real-time visualizations, ensuring alignment with OKRs and supporting executive decision-making
Served as a liaison between business stakeholders, development teams, and external clients, ensuring seamless communication and project alignment. Converted business requirements into actionable JIRA tickets and led sprint planning to improve release timelines by 15% 
Planned and executed data system upgrades for customers transitioning from legacy traceability software to new platforms, working closely with Customer Success managers to ensure smooth data migration and system integration. Successfully migrated 38% of customers within 4 months, ensuring minimal disruption and seamless operations. 
Conducted comprehensive financial data analysis to identify the largest customers and determine revenue contributions, leading to a strategic focus on high-revenue clients and resulting in cost savings of $X million from the biggest customer.
Performed detailed analysis of effort costing, including IT infrastructure and development costs, identifying areas for cost optimization and savings.
Led transformational changes in supply chain management through data-driven solutions and AI/ML integration, enhancing decision-making and operational efficiency. Improved supply chain forecast accuracy by 30%, reduced latency by XX%, and achieved a 35% increase in throughput in customer onboarding
Facilitated User Acceptance Testing and automated the customer onboarding process, resulting in a 35% increase in throughput

Vvf India Limited | Project Manager Mumbai, India.                                                                                                        Dec 2017 to Aug 2022
As a Supply Chain Project Manager, led several key projects that optimized the supply chain process, improved manufacturing efficiency, and successfully passed internal audits by McKinsey. Achieved global inventory reduction and led the SAP GST Implementation roll-out team.
Specific projects:
Led end-to-end SAP GST Implementation and order fulfillment optimization, achieving an XX% increase in compliance and process efficiency.
Championed inventory optimization through demand and supply planning initiatives, implementing lean practices that resulted in a 25% reduction in inventory and significant cost savings.
Developed and managed project plans, communication strategies, and resource allocation to ensure project success, reducing project completion time by 20%.
Developed detailed business cases, project proposals, and ROI calculations to fast-track initiatives, providing management with actionable insights for strategic approval

India Power Limited | Deputy Manager Projects, Kolkata, India 			        Mar 2016 to Nov 2017
For a short stint, I joined India Power to work on streamlining the supply chain, aiming to enhance organizational efficiency. 
Specific projects:
Implemented SAP PM (Plant Maintenance) and MM (Materials Management) modules to replace manual purchasing, order generation, and billing processes across all platforms, enhancing organizational efficiency by 25% by streamlining the Order to Billing management process

Bajaj Energy Limited | Deputy Manager Projects, Noida, India			        Feb 2013 to Mar 2016
After Abhijeet Projects, I joined Bajaj Energy as the Supply Chain Project Manager to lead a data-driven project focused on securing an excise tax waiver from the federal government. The waiver amount achieved was almost double that of my previous project
Specific projects:
Secured Mega Power Project Status through data-driven analysis and strategic regulatory negotiations, achieving $XX million in cost savings and strengthening compliance with federal standards.

Abhijeet Projects Limited Asst. Manager Projects, Ranchi, India			        Sept 2010 to Jan 2013
Following my role at Airox Nigen, I joined Abhijeet Projects as a Project Manager. In this role, I directed strategic supply chain initiatives aimed at process optimization and regulatory compliance, working closely with federal government stakeholders to drive substantial cost savings and enhance operational efficiency.
Specific projects:
Led process mapping and optimization projects, achieving compliance with regulatory requirements and significant cost savings of $XX million. Demonstrated strong skills in regulatory navigation and cross-functional collaboration to achieve strategic objectives.

Airox Nigen | , Asst. Manager Projects Gurgaon, India	                             April 2009 to Sept 2010
Directly hired from school to manage business development initiatives, focusing on enhancing the company’s online presence and user experience

Skills 
Functional: Agile, SDLC, Jira, Process Mapping, Delivery Presentation, Data Analysis, Dash Boarding, Data Optimization
Technical: SAP, Python, MySQL, Kibana, Tableau, AWS, Elastic Search, MS Excel, SPSS, Git

Education and Academic Background
California State University East Bay, Hayward, CA
M.S. in Business Analytics, Aug 2022 to Dec 2023

Sathyabama Deemed University Chennai, India
B.Tech. in Chemical Engineering (Major), Aug 2005 - April 2009
B.E.  in Computer Science & Engineering (Minor), Aug 2006 – April 2009",Kumar.Abhinav 9.docx
